{
  "bundle_id": "BUNDLE_001",
  "generated_at": "2026-01-23T10:36:00Z",
  "query": "bearing wear",
  "score_metric": "test",
  "score_threshold": 0.0,
  "retrieval_scope": {
    "event_id": "E2026-01-23-001",
    "asset_id": "PUMP_A_01"
  },
  "results": [
    {
      "snippet_id": "SNIP_001",
      "doc_id": "CR:DEMO:0001",
      "score": 0.9,
      "snippet": "Bearing wear suspected"
    }
  ],
  "supersession_applied": false,
  "supersession_count": 0
}